{
  "updated_at": "2026-02-13T14:26:57.155314",
  "count": 20,
  "bandi": [
    {
      "id": "bando_1_470505636",
      "cig": "470505636",
      "titolo": "Riqualificazione energetica immobili comunali - Padova",
      "stazione_appaltante": "Unione Comuni Padova",
      "importo": 810474,
      "importo_str": "€ 810,474.00",
      "categoria": "OG6",
      "classifica": "III",
      "regione": "Veneto",
      "provincia": "Padova",
      "provincia_sigla": "PD",
      "comune": "Padova",
      "scadenza": "14/05/2026",
      "scadenza_iso": "2026-05-14T14:26:57.154815",
      "giorni_scadenza": 90,
      "tipo_procedura": "Aperta",
      "criterio": "Offerta economicamente più vantaggiosa",
      "url": "https://www.anticorruzione.it/gara/470505636",
      "estratto_at": "2026-02-13T14:26:57.155314",
      "fonte": "ANAC OpenData (Mock)",
      "lat": 45.37486576497958,
      "lon": 11.923917978461155
    },
    {
      "id": "bando_2_391447394",
      "cig": "391447394",
      "titolo": "Costruzione nuovo edificio polifunzionale - Bolzano",
      "stazione_appaltante": "Comunità Montana Bolzano",
      "importo": 472313,
      "importo_str": "€ 472,313.00",
      "categoria": "OS6",
      "classifica": "V",
      "regione": "Trentino-Alto Adige",
      "provincia": "Bolzano",
      "provincia_sigla": "BZ",
      "comune": "Bolzano",
      "scadenza": "11/05/2026",
      "scadenza_iso": "2026-05-11T14:26:57.155314",
      "giorni_scadenza": 87,
      "tipo_procedura": "Aperta",
      "criterio": "Offerta economicamente più vantaggiosa",
      "url": "https://www.anticorruzione.it/gara/391447394",
      "estratto_at": "2026-02-13T14:26:57.155314",
      "fonte": "ANAC OpenData (Mock)",
      "lat": 46.50864881113088,
      "lon": 11.382612183812991
    },
    {
      "id": "bando_3_443617470",
      "cig": "443617470",
      "titolo": "Manutenzione stradale ordinaria - Sud Sardegna",
      "stazione_appaltante": "Unione Comuni Sud Sardegna",
      "importo": 2233149,
      "importo_str": "€ 2,233,149.00",
      "categoria": "OG6",
      "classifica": "V",
      "regione": "Sardegna",
      "provincia": "Sud Sardegna",
      "provincia_sigla": "SU",
      "comune": "Sud Sardegna",
      "scadenza": "04/03/2026",
      "scadenza_iso": "2026-03-04T14:26:57.155314",
      "giorni_scadenza": 19,
      "tipo_procedura": "Negoziata",
      "criterio": "Offerta economicamente più vantaggiosa",
      "url": "https://www.anticorruzione.it/gara/443617470",
      "estratto_at": "2026-02-13T14:26:57.155314",
      "fonte": "ANAC OpenData (Mock)",
      "lat": 39.122978394082935,
      "lon": 8.538728462071465
    },
    {
      "id": "bando_4_364716386",
      "cig": "364716386",
      "titolo": "Manutenzione stradale ordinaria - Avellino",
      "stazione_appaltante": "Provincia di Avellino",
      "importo": 3602544,
      "importo_str": "€ 3,602,544.00",
      "categoria": "OG1",
      "classifica": "V",
      "regione": "Campania",
      "provincia": "Avellino",
      "provincia_sigla": "AV",
      "comune": "Avellino",
      "scadenza": "06/05/2026",
      "scadenza_iso": "2026-05-06T14:26:57.155314",
      "giorni_scadenza": 82,
      "tipo_procedura": "Affidamento Diretto",
      "criterio": "Prezzo più basso",
      "url": "https://www.anticorruzione.it/gara/364716386",
      "estratto_at": "2026-02-13T14:26:57.155314",
      "fonte": "ANAC OpenData (Mock)",
      "lat": 40.957721426761566,
      "lon": 14.826054788205646
    },
    {
      "id": "bando_5_498860817",
      "cig": "498860817",
      "titolo": "Manutenzione straordinaria viabilità comunale - Avellino",
      "stazione_appaltante": "Provincia di Avellino",
      "importo": 2102822,
      "importo_str": "€ 2,102,822.00",
      "categoria": "OG6",
      "classifica": "IV",
      "regione": "Campania",
      "provincia": "Avellino",
      "provincia_sigla": "AV",
      "comune": "Avellino",
      "scadenza": "14/04/2026",
      "scadenza_iso": "2026-04-14T14:26:57.155314",
      "giorni_scadenza": 60,
      "tipo_procedura": "Affidamento Diretto",
      "criterio": "Offerta economicamente più vantaggiosa",
      "url": "https://www.anticorruzione.it/gara/498860817",
      "estratto_at": "2026-02-13T14:26:57.155314",
      "fonte": "ANAC OpenData (Mock)",
      "lat": 40.8955375562929,
      "lon": 14.82999721275675
    },
    {
      "id": "bando_6_387908172",
      "cig": "387908172",
      "titolo": "Ristrutturazione edificio scolastico - Terni",
      "stazione_appaltante": "Unione Comuni Terni",
      "importo": 256350,
      "importo_str": "€ 256,350.00",
      "categoria": "OG3",
      "classifica": "VI",
      "regione": "Umbria",
      "provincia": "Terni",
      "provincia_sigla": "TR",
      "comune": "Terni",
      "scadenza": "02/03/2026",
      "scadenza_iso": "2026-03-02T14:26:57.155314",
      "giorni_scadenza": 17,
      "tipo_procedura": "Affidamento Diretto",
      "criterio": "Offerta economicamente più vantaggiosa",
      "url": "https://www.anticorruzione.it/gara/387908172",
      "estratto_at": "2026-02-13T14:26:57.155314",
      "fonte": "ANAC OpenData (Mock)",
      "lat": 42.60511858427001,
      "lon": 12.675862874597238
    },
    {
      "id": "bando_7_859542315",
      "cig": "859542315",
      "titolo": "Adeguamento sismico scuola elementare - Bolzano",
      "stazione_appaltante": "Unione Comuni Bolzano",
      "importo": 1071636,
      "importo_str": "€ 1,071,636.00",
      "categoria": "OG11",
      "classifica": "II",
      "regione": "Trentino-Alto Adige",
      "provincia": "Bolzano",
      "provincia_sigla": "BZ",
      "comune": "Bolzano",
      "scadenza": "10/05/2026",
      "scadenza_iso": "2026-05-10T14:26:57.155314",
      "giorni_scadenza": 86,
      "tipo_procedura": "Aperta",
      "criterio": "Offerta economicamente più vantaggiosa",
      "url": "https://www.anticorruzione.it/gara/859542315",
      "estratto_at": "2026-02-13T14:26:57.155314",
      "fonte": "ANAC OpenData (Mock)",
      "lat": 46.542434979602774,
      "lon": 11.399192289688676
    },
    {
      "id": "bando_8_270833897",
      "cig": "270833897",
      "titolo": "Ampliamento scuola media - Cagliari",
      "stazione_appaltante": "Unione Comuni Cagliari",
      "importo": 482993,
      "importo_str": "€ 482,993.00",
      "categoria": "OS28",
      "classifica": "IV",
      "regione": "Sardegna",
      "provincia": "Cagliari",
      "provincia_sigla": "CA",
      "comune": "Cagliari",
      "scadenza": "11/04/2026",
      "scadenza_iso": "2026-04-11T14:26:57.155314",
      "giorni_scadenza": 57,
      "tipo_procedura": "Negoziata",
      "criterio": "Prezzo più basso",
      "url": "https://www.anticorruzione.it/gara/270833897",
      "estratto_at": "2026-02-13T14:26:57.155314",
      "fonte": "ANAC OpenData (Mock)",
      "lat": 39.26281870071637,
      "lon": 9.153123312967761
    },
    {
      "id": "bando_9_860923794",
      "cig": "860923794",
      "titolo": "Manutenzione stradale ordinaria - Agrigento",
      "stazione_appaltante": "Provincia di Agrigento",
      "importo": 556560,
      "importo_str": "€ 556,560.00",
      "categoria": "OS28",
      "classifica": "IV",
      "regione": "Sicilia",
      "provincia": "Agrigento",
      "provincia_sigla": "AG",
      "comune": "Agrigento",
      "scadenza": "08/04/2026",
      "scadenza_iso": "2026-04-08T14:26:57.155314",
      "giorni_scadenza": 54,
      "tipo_procedura": "Affidamento Diretto",
      "criterio": "Offerta economicamente più vantaggiosa",
      "url": "https://www.anticorruzione.it/gara/860923794",
      "estratto_at": "2026-02-13T14:26:57.155314",
      "fonte": "ANAC OpenData (Mock)",
      "lat": 37.27268082575534,
      "lon": 13.5599010308845
    },
    {
      "id": "bando_10_597909560",
      "cig": "597909560",
      "titolo": "Rifacimento copertura edificio pubblico - Cagliari",
      "stazione_appaltante": "Provincia di Cagliari",
      "importo": 583695,
      "importo_str": "€ 583,695.00",
      "categoria": "OG6",
      "classifica": "VII",
      "regione": "Sardegna",
      "provincia": "Cagliari",
      "provincia_sigla": "CA",
      "comune": "Cagliari",
      "scadenza": "30/04/2026",
      "scadenza_iso": "2026-04-30T14:26:57.155314",
      "giorni_scadenza": 76,
      "tipo_procedura": "Negoziata",
      "criterio": "Offerta economicamente più vantaggiosa",
      "url": "https://www.anticorruzione.it/gara/597909560",
      "estratto_at": "2026-02-13T14:26:57.155314",
      "fonte": "ANAC OpenData (Mock)",
      "lat": 39.23981784251484,
      "lon": 9.090407676013125
    },
    {
      "id": "bando_11_489014855",
      "cig": "489014855",
      "titolo": "Costruzione centro sportivo - Grosseto",
      "stazione_appaltante": "Provincia di Grosseto",
      "importo": 1153531,
      "importo_str": "€ 1,153,531.00",
      "categoria": "OG1",
      "classifica": "II",
      "regione": "Toscana",
      "provincia": "Grosseto",
      "provincia_sigla": "GR",
      "comune": "Grosseto",
      "scadenza": "05/03/2026",
      "scadenza_iso": "2026-03-05T14:26:57.155314",
      "giorni_scadenza": 20,
      "tipo_procedura": "Negoziata",
      "criterio": "Offerta economicamente più vantaggiosa",
      "url": "https://www.anticorruzione.it/gara/489014855",
      "estratto_at": "2026-02-13T14:26:57.155314",
      "fonte": "ANAC OpenData (Mock)",
      "lat": 42.789939882237086,
      "lon": 11.067456079653965
    },
    {
      "id": "bando_12_657343313",
      "cig": "657343313",
      "titolo": "Manutenzione stradale ordinaria - Messina",
      "stazione_appaltante": "Unione Comuni Messina",
      "importo": 2734006,
      "importo_str": "€ 2,734,006.00",
      "categoria": "OG6",
      "classifica": "V",
      "regione": "Sicilia",
      "provincia": "Messina",
      "provincia_sigla": "ME",
      "comune": "Messina",
      "scadenza": "05/03/2026",
      "scadenza_iso": "2026-03-05T14:26:57.155314",
      "giorni_scadenza": 20,
      "tipo_procedura": "Affidamento Diretto",
      "criterio": "Prezzo più basso",
      "url": "https://www.anticorruzione.it/gara/657343313",
      "estratto_at": "2026-02-13T14:26:57.155314",
      "fonte": "ANAC OpenData (Mock)",
      "lat": 38.15873192805901,
      "lon": 15.568112351569992
    },
    {
      "id": "bando_13_253674329",
      "cig": "253674329",
      "titolo": "Rifacimento copertura edificio pubblico - Verona",
      "stazione_appaltante": "Comune di Verona",
      "importo": 771589,
      "importo_str": "€ 771,589.00",
      "categoria": "OS30",
      "classifica": "V",
      "regione": "Veneto",
      "provincia": "Verona",
      "provincia_sigla": "VR",
      "comune": "Verona",
      "scadenza": "29/04/2026",
      "scadenza_iso": "2026-04-29T14:26:57.155314",
      "giorni_scadenza": 75,
      "tipo_procedura": "Aperta",
      "criterio": "Prezzo più basso",
      "url": "https://www.anticorruzione.it/gara/253674329",
      "estratto_at": "2026-02-13T14:26:57.155314",
      "fonte": "ANAC OpenData (Mock)",
      "lat": 45.44378705263021,
      "lon": 10.948324572372957
    },
    {
      "id": "bando_14_594520866",
      "cig": "594520866",
      "titolo": "Ampliamento scuola media - Belluno",
      "stazione_appaltante": "Unione Comuni Belluno",
      "importo": 3851383,
      "importo_str": "€ 3,851,383.00",
      "categoria": "OG3",
      "classifica": "VIII",
      "regione": "Veneto",
      "provincia": "Belluno",
      "provincia_sigla": "BL",
      "comune": "Belluno",
      "scadenza": "22/04/2026",
      "scadenza_iso": "2026-04-22T14:26:57.155314",
      "giorni_scadenza": 68,
      "tipo_procedura": "Negoziata",
      "criterio": "Offerta economicamente più vantaggiosa",
      "url": "https://www.anticorruzione.it/gara/594520866",
      "estratto_at": "2026-02-13T14:26:57.155314",
      "fonte": "ANAC OpenData (Mock)",
      "lat": 46.14478369523488,
      "lon": 12.180663114784977
    },
    {
      "id": "bando_15_313521742",
      "cig": "313521742",
      "titolo": "Manutenzione straordinaria viabilità comunale - Benevento",
      "stazione_appaltante": "Comunità Montana Benevento",
      "importo": 876916,
      "importo_str": "€ 876,916.00",
      "categoria": "OS30",
      "classifica": "VII",
      "regione": "Campania",
      "provincia": "Benevento",
      "provincia_sigla": "BN",
      "comune": "Benevento",
      "scadenza": "24/03/2026",
      "scadenza_iso": "2026-03-24T14:26:57.155314",
      "giorni_scadenza": 39,
      "tipo_procedura": "Negoziata",
      "criterio": "Prezzo più basso",
      "url": "https://www.anticorruzione.it/gara/313521742",
      "estratto_at": "2026-02-13T14:26:57.155314",
      "fonte": "ANAC OpenData (Mock)",
      "lat": 41.0920702255315,
      "lon": 14.806659680348591
    },
    {
      "id": "bando_16_258756622",
      "cig": "258756622",
      "titolo": "Ampliamento scuola media - Milano",
      "stazione_appaltante": "Comunità Montana Milano",
      "importo": 1947561,
      "importo_str": "€ 1,947,561.00",
      "categoria": "OG11",
      "classifica": "I",
      "regione": "Lombardia",
      "provincia": "Milano",
      "provincia_sigla": "MI",
      "comune": "Milano",
      "scadenza": "28/03/2026",
      "scadenza_iso": "2026-03-28T14:26:57.155314",
      "giorni_scadenza": 43,
      "tipo_procedura": "Affidamento Diretto",
      "criterio": "Prezzo più basso",
      "url": "https://www.anticorruzione.it/gara/258756622",
      "estratto_at": "2026-02-13T14:26:57.155314",
      "fonte": "ANAC OpenData (Mock)",
      "lat": 45.50095750169031,
      "lon": 9.206789798955526
    },
    {
      "id": "bando_17_744561226",
      "cig": "744561226",
      "titolo": "Riqualificazione energetica immobili comunali - Sud Sardegna",
      "stazione_appaltante": "Comunità Montana Sud Sardegna",
      "importo": 465481,
      "importo_str": "€ 465,481.00",
      "categoria": "OG3",
      "classifica": "I",
      "regione": "Sardegna",
      "provincia": "Sud Sardegna",
      "provincia_sigla": "SU",
      "comune": "Sud Sardegna",
      "scadenza": "24/04/2026",
      "scadenza_iso": "2026-04-24T14:26:57.155314",
      "giorni_scadenza": 70,
      "tipo_procedura": "Affidamento Diretto",
      "criterio": "Offerta economicamente più vantaggiosa",
      "url": "https://www.anticorruzione.it/gara/744561226",
      "estratto_at": "2026-02-13T14:26:57.155314",
      "fonte": "ANAC OpenData (Mock)",
      "lat": 39.196671262846415,
      "lon": 8.576626019648817
    },
    {
      "id": "bando_18_510358726",
      "cig": "510358726",
      "titolo": "Bonifica area industriale dismessa - Grosseto",
      "stazione_appaltante": "Unione Comuni Grosseto",
      "importo": 376471,
      "importo_str": "€ 376,471.00",
      "categoria": "OS6",
      "classifica": "I",
      "regione": "Toscana",
      "provincia": "Grosseto",
      "provincia_sigla": "GR",
      "comune": "Grosseto",
      "scadenza": "05/05/2026",
      "scadenza_iso": "2026-05-05T14:26:57.155314",
      "giorni_scadenza": 81,
      "tipo_procedura": "Negoziata",
      "criterio": "Offerta economicamente più vantaggiosa",
      "url": "https://www.anticorruzione.it/gara/510358726",
      "estratto_at": "2026-02-13T14:26:57.155314",
      "fonte": "ANAC OpenData (Mock)",
      "lat": 42.808229142339734,
      "lon": 11.068753499281057
    },
    {
      "id": "bando_19_775325987",
      "cig": "775325987",
      "titolo": "Costruzione nuovo edificio polifunzionale - Perugia",
      "stazione_appaltante": "Provincia di Perugia",
      "importo": 3873562,
      "importo_str": "€ 3,873,562.00",
      "categoria": "OG1",
      "classifica": "IV",
      "regione": "Umbria",
      "provincia": "Perugia",
      "provincia_sigla": "PG",
      "comune": "Perugia",
      "scadenza": "09/04/2026",
      "scadenza_iso": "2026-04-09T14:26:57.155314",
      "giorni_scadenza": 55,
      "tipo_procedura": "Affidamento Diretto",
      "criterio": "Offerta economicamente più vantaggiosa",
      "url": "https://www.anticorruzione.it/gara/775325987",
      "estratto_at": "2026-02-13T14:26:57.155314",
      "fonte": "ANAC OpenData (Mock)",
      "lat": 43.158396087679385,
      "lon": 12.385279942662846
    },
    {
      "id": "bando_20_954822568",
      "cig": "954822568",
      "titolo": "Opere urbanizzazione lottizzazione - Napoli",
      "stazione_appaltante": "Unione Comuni Napoli",
      "importo": 1462852,
      "importo_str": "€ 1,462,852.00",
      "categoria": "OS30",
      "classifica": "VIII",
      "regione": "Campania",
      "provincia": "Napoli",
      "provincia_sigla": "NA",
      "comune": "Napoli",
      "scadenza": "18/04/2026",
      "scadenza_iso": "2026-04-18T14:26:57.155314",
      "giorni_scadenza": 64,
      "tipo_procedura": "Affidamento Diretto",
      "criterio": "Offerta economicamente più vantaggiosa",
      "url": "https://www.anticorruzione.it/gara/954822568",
      "estratto_at": "2026-02-13T14:26:57.155314",
      "fonte": "ANAC OpenData (Mock)",
      "lat": 40.822088101520464,
      "lon": 14.256293310971788
    }
  ]
}